{
  "company": "camp",
  "fetched_at": "2025-11-09T04:04:52.541875",
  "job_count": 45,
  "jobs": [
    {
      "absolute_url": "https://job-boards.greenhouse.io/camp/jobs/8130265002",
      "data_compliance": [
        {
          "type": "gdpr",
          "requires_consent": false,
          "requires_processing_consent": false,
          "requires_retention_consent": false,
          "retention_period": null,
          "demographic_data_consent_applies": false
        }
      ],
      "internal_job_id": 6221120002,
      "location": {
        "name": "King of Prussia, PA"
      },
      "metadata": null,
      "id": 8130265002,
      "updated_at": "2025-09-17T11:37:54-04:00",
      "requisition_id": "8/21/2025 KOP PERF",
      "title": "Activity Guide / Play Expert ",
      "company_name": "CAMP",
      "first_published": "2025-08-21T10:56:22-04:00",
      "language": "en"
    },
    {
      "absolute_url": "https://job-boards.greenhouse.io/camp/jobs/8049611002",
      "data_compliance": [
        {
          "type": "gdpr",
          "requires_consent": false,
          "requires_processing_consent": false,
          "requires_retention_consent": false,
          "retention_period": null,
          "demographic_data_consent_applies": false
        }
      ],
      "internal_job_id": 6186594002,
      "location": {
        "name": "Mc Lean, VA (Tysons Corner)"
      },
      "metadata": null,
      "id": 8049611002,
      "updated_at": "2025-07-21T12:00:00-04:00",
      "requisition_id": "6/24/25 Perf Tysons",
      "title": "Actors/Performers ",
      "company_name": "CAMP",
      "first_published": "2025-06-24T19:17:36-04:00",
      "language": "en"
    },
    {
      "absolute_url": "https://job-boards.greenhouse.io/camp/jobs/8102078002",
      "data_compliance": [
        {
          "type": "gdpr",
          "requires_consent": false,
          "requires_processing_consent": false,
          "requires_retention_consent": false,
          "retention_period": null,
          "demographic_data_consent_applies": false
        }
      ],
      "internal_job_id": 6209238002,
      "location": {
        "name": "Charlotte, NC (Southpark)"
      },
      "metadata": null,
      "id": 8102078002,
      "updated_at": "2025-08-25T19:06:48-04:00",
      "requisition_id": "8/1/2025_CHAR Perf",
      "title": "Actors/Performers ",
      "company_name": "CAMP",
      "first_published": "2025-08-01T08:44:34-04:00",
      "language": "en"
    },
    {
      "absolute_url": "https://job-boards.greenhouse.io/camp/jobs/8102087002",
      "data_compliance": [
        {
          "type": "gdpr",
          "requires_consent": false,
          "requires_processing_consent": false,
          "requires_retention_consent": false,
          "retention_period": null,
          "demographic_data_consent_applies": false
        }
      ],
      "internal_job_id": 6209240002,
      "location": {
        "name": "Los Angeles, CA (Century City)"
      },
      "metadata": null,
      "id": 8102087002,
      "updated_at": "2025-08-08T15:53:51-04:00",
      "requisition_id": "8/1/2025 Perf LA",
      "title": "Actors/Performers ",
      "company_name": "CAMP",
      "first_published": "2025-08-01T08:48:33-04:00",
      "language": "en"
    },
    {
      "absolute_url": "https://job-boards.greenhouse.io/camp/jobs/8087582002",
      "data_compliance": [
        {
          "type": "gdpr",
          "requires_consent": false,
          "requires_processing_consent": false,
          "requires_retention_consent": false,
          "retention_period": null,
          "demographic_data_consent_applies": false
        }
      ],
      "internal_job_id": 6203221002,
      "location": {
        "name": "King of Prussia, PA"
      },
      "metadata": null,
      "id": 8087582002,
      "updated_at": "2025-09-17T19:27:23-04:00",
      "requisition_id": "7/22/25 KOP Performer",
      "title": "Actors/Performers for a Bluey x CAMP Immersive Production",
      "company_name": "CAMP",
      "first_published": "2025-07-22T22:54:47-04:00",
      "language": "en"
    },
    {
      "absolute_url": "https://job-boards.greenhouse.io/camp/jobs/8200313002",
      "data_compliance": [
        {
          "type": "gdpr",
          "requires_consent": false,
          "requires_processing_consent": false,
          "requires_retention_consent": false,
          "retention_period": null,
          "demographic_data_consent_applies": false
        }
      ],
      "internal_job_id": 6250158002,
      "location": {
        "name": "Houston, TX"
      },
      "metadata": null,
      "id": 8200313002,
      "updated_at": "2025-10-06T19:03:04-04:00",
      "requisition_id": "10/6/25 Perf Hou",
      "title": "Actors/Performers for a Bluey x CAMP Immersive Production",
      "company_name": "CAMP",
      "first_published": "2025-10-06T19:02:36-04:00",
      "language": "en"
    },
    {
      "absolute_url": "https://job-boards.greenhouse.io/camp/jobs/8199230002",
      "data_compliance": [
        {
          "type": "gdpr",
          "requires_consent": false,
          "requires_processing_consent": false,
          "requires_retention_consent": false,
          "retention_period": null,
          "demographic_data_consent_applies": false
        }
      ],
      "internal_job_id": 6249646002,
      "location": {
        "name": "New York, NY (5th Avenue)"
      },
      "metadata": null,
      "id": 8199230002,
      "updated_at": "2025-10-06T09:30:11-04:00",
      "requisition_id": "10//6/25 5th Per",
      "title": "Actors/Performers for a Bluey x CAMP Immersive Production",
      "company_name": "CAMP",
      "first_published": "2025-10-06T09:30:11-04:00",
      "language": "en"
    },
    {
      "absolute_url": "https://job-boards.greenhouse.io/camp/jobs/8136656002",
      "data_compliance": [
        {
          "type": "gdpr",
          "requires_consent": false,
          "requires_processing_consent": false,
          "requires_retention_consent": false,
          "retention_period": null,
          "demographic_data_consent_applies": false
        }
      ],
      "internal_job_id": 6223619002,
      "location": {
        "name": "Burlington, MA"
      },
      "metadata": null,
      "id": 8136656002,
      "updated_at": "2025-09-17T11:37:39-04:00",
      "requisition_id": "8/25/25 MA Performer",
      "title": "Actors/Performers for a Bluey x CAMP Production",
      "company_name": "CAMP",
      "first_published": "2025-08-25T16:58:36-04:00",
      "language": "en"
    },
    {
      "absolute_url": "https://job-boards.greenhouse.io/camp/jobs/8148806002",
      "data_compliance": [
        {
          "type": "gdpr",
          "requires_consent": false,
          "requires_processing_consent": false,
          "requires_retention_consent": false,
          "retention_period": null,
          "demographic_data_consent_applies": false
        }
      ],
      "internal_job_id": 6229002002,
      "location": {
        "name": "Chicago, IL"
      },
      "metadata": null,
      "id": 8148806002,
      "updated_at": "2025-09-02T14:03:54-04:00",
      "requisition_id": "9/2/25 CHI Perf",
      "title": "Actors/Performers for PAW Patrol x CAMP collaboration ",
      "company_name": "CAMP",
      "first_published": "2025-09-02T14:03:54-04:00",
      "language": "en"
    },
    {
      "absolute_url": "https://job-boards.greenhouse.io/camp/jobs/8173982002",
      "data_compliance": [
        {
          "type": "gdpr",
          "requires_consent": false,
          "requires_processing_consent": false,
          "requires_retention_consent": false,
          "retention_period": null,
          "demographic_data_consent_applies": false
        }
      ],
      "education": "education_optional",
      "internal_job_id": 6239472002,
      "location": {
        "name": "Miami, FL (Aventura)"
      },
      "metadata": null,
      "id": 8173982002,
      "updated_at": "2025-09-17T16:12:51-04:00",
      "requisition_id": "9/17/25 Miami ASM1",
      "title": "Assistant Store Manager (full-time) - Canteen and Sponsorships",
      "company_name": "CAMP",
      "first_published": "2025-09-17T16:12:51-04:00",
      "language": "en"
    },
    {
      "absolute_url": "https://job-boards.greenhouse.io/camp/jobs/8229619002",
      "data_compliance": [
        {
          "type": "gdpr",
          "requires_consent": false,
          "requires_processing_consent": false,
          "requires_retention_consent": false,
          "retention_period": null,
          "demographic_data_consent_applies": false
        }
      ],
      "education": "education_optional",
      "internal_job_id": 6261491002,
      "location": {
        "name": "Los Angeles, CA (Century City)"
      },
      "metadata": null,
      "id": 8229619002,
      "updated_at": "2025-10-27T17:08:43-04:00",
      "requisition_id": "10/27/25 ASM LA",
      "title": "Assistant Store Manager (full-time) - Canteen and Sponsorships",
      "company_name": "CAMP",
      "first_published": "2025-10-27T17:08:43-04:00",
      "language": "en"
    },
    {
      "absolute_url": "https://job-boards.greenhouse.io/camp/jobs/8173988002",
      "data_compliance": [
        {
          "type": "gdpr",
          "requires_consent": false,
          "requires_processing_consent": false,
          "requires_retention_consent": false,
          "retention_period": null,
          "demographic_data_consent_applies": false
        }
      ],
      "education": "education_optional",
      "internal_job_id": 6239476002,
      "location": {
        "name": "Miami, FL (Aventura)"
      },
      "metadata": null,
      "id": 8173988002,
      "updated_at": "2025-09-17T16:20:50-04:00",
      "requisition_id": "9/17/25 Miami ASM 2",
      "title": "Assistant Store Manager (full-time) - Programming and Special Events",
      "company_name": "CAMP",
      "first_published": "2025-09-17T16:20:50-04:00",
      "language": "en"
    },
    {
      "absolute_url": "https://job-boards.greenhouse.io/camp/jobs/8174243002",
      "data_compliance": [
        {
          "type": "gdpr",
          "requires_consent": false,
          "requires_processing_consent": false,
          "requires_retention_consent": false,
          "retention_period": null,
          "demographic_data_consent_applies": false
        }
      ],
      "internal_job_id": 6239598002,
      "location": {
        "name": "Edina, MN (Southdale)"
      },
      "metadata": null,
      "id": 8174243002,
      "updated_at": "2025-10-24T17:23:10-04:00",
      "requisition_id": "9/17/2025 MN Mascot",
      "title": "Character Performer/Mascot",
      "company_name": "CAMP",
      "first_published": "2025-09-17T19:25:03-04:00",
      "language": "en"
    },
    {
      "absolute_url": "https://job-boards.greenhouse.io/camp/jobs/8174231002",
      "data_compliance": [
        {
          "type": "gdpr",
          "requires_consent": false,
          "requires_processing_consent": false,
          "requires_retention_consent": false,
          "retention_period": null,
          "demographic_data_consent_applies": false
        }
      ],
      "internal_job_id": 6239591002,
      "location": {
        "name": "Miami, FL (Aventura)"
      },
      "metadata": null,
      "id": 8174231002,
      "updated_at": "2025-10-24T18:02:20-04:00",
      "requisition_id": "9/17/2025 Miami Mascot",
      "title": "Character Performer/Mascot",
      "company_name": "CAMP",
      "first_published": "2025-09-17T19:23:06-04:00",
      "language": "en"
    },
    {
      "absolute_url": "https://job-boards.greenhouse.io/camp/jobs/8081290002",
      "data_compliance": [
        {
          "type": "gdpr",
          "requires_consent": false,
          "requires_processing_consent": false,
          "requires_retention_consent": false,
          "retention_period": null,
          "demographic_data_consent_applies": false
        }
      ],
      "internal_job_id": 6200529002,
      "location": {
        "name": "Houston, TX"
      },
      "metadata": null,
      "id": 8081290002,
      "updated_at": "2025-10-06T18:59:31-04:00",
      "requisition_id": "7/17/25 HOU Mascot",
      "title": "Character Performers/Mascots for Bluey x CAMP Production ",
      "company_name": "CAMP",
      "first_published": "2025-07-17T17:24:20-04:00",
      "language": "en"
    },
    {
      "absolute_url": "https://job-boards.greenhouse.io/camp/jobs/8087581002",
      "data_compliance": [
        {
          "type": "gdpr",
          "requires_consent": false,
          "requires_processing_consent": false,
          "requires_retention_consent": false,
          "retention_period": null,
          "demographic_data_consent_applies": false
        }
      ],
      "internal_job_id": 6203220002,
      "location": {
        "name": "King of Prussia, PA"
      },
      "metadata": null,
      "id": 8087581002,
      "updated_at": "2025-09-17T11:37:21-04:00",
      "requisition_id": "7/22/25 KOP Mascot",
      "title": "Character Performers/Mascots for Bluey x CAMP Production ",
      "company_name": "CAMP",
      "first_published": "2025-07-22T22:51:23-04:00",
      "language": "en"
    },
    {
      "absolute_url": "https://job-boards.greenhouse.io/camp/jobs/8120329002",
      "data_compliance": [
        {
          "type": "gdpr",
          "requires_consent": false,
          "requires_processing_consent": false,
          "requires_retention_consent": false,
          "retention_period": null,
          "demographic_data_consent_applies": false
        }
      ],
      "education": "education_optional",
      "internal_job_id": 6217016002,
      "location": {
        "name": "Mc Lean, VA (Tysons Corner)"
      },
      "metadata": null,
      "id": 8120329002,
      "updated_at": "2025-09-22T15:23:02-04:00",
      "requisition_id": "8/14/25_VA_C_AMB",
      "title": "Community Ambassador (PT)",
      "company_name": "CAMP",
      "first_published": "2025-08-14T14:44:47-04:00",
      "language": "en"
    },
    {
      "absolute_url": "https://job-boards.greenhouse.io/camp/jobs/8102073002",
      "data_compliance": [
        {
          "type": "gdpr",
          "requires_consent": false,
          "requires_processing_consent": false,
          "requires_retention_consent": false,
          "retention_period": null,
          "demographic_data_consent_applies": false
        }
      ],
      "internal_job_id": 6209235002,
      "location": {
        "name": "Los Angeles, CA (Century City)"
      },
      "metadata": null,
      "id": 8102073002,
      "updated_at": "2025-08-01T08:40:06-04:00",
      "requisition_id": "8/1/2025 MAS LA",
      "title": "Costumed Characters (Mascot)",
      "company_name": "CAMP",
      "first_published": "2025-08-01T08:40:06-04:00",
      "language": "en"
    },
    {
      "absolute_url": "https://job-boards.greenhouse.io/camp/jobs/8102062002",
      "data_compliance": [
        {
          "type": "gdpr",
          "requires_consent": false,
          "requires_processing_consent": false,
          "requires_retention_consent": false,
          "retention_period": null,
          "demographic_data_consent_applies": false
        }
      ],
      "internal_job_id": 6209230002,
      "location": {
        "name": "Charlotte, NC (Southpark)"
      },
      "metadata": null,
      "id": 8102062002,
      "updated_at": "2025-08-01T08:35:23-04:00",
      "requisition_id": "8/1/25 MAS CHAR",
      "title": "Costumed Characters (Mascot)",
      "company_name": "CAMP",
      "first_published": "2025-08-01T08:35:23-04:00",
      "language": "en"
    },
    {
      "absolute_url": "https://job-boards.greenhouse.io/camp/jobs/8049620002",
      "data_compliance": [
        {
          "type": "gdpr",
          "requires_consent": false,
          "requires_processing_consent": false,
          "requires_retention_consent": false,
          "retention_period": null,
          "demographic_data_consent_applies": false
        }
      ],
      "internal_job_id": 6186602002,
      "location": {
        "name": "Mc Lean, VA (Tysons Corner)"
      },
      "metadata": null,
      "id": 8049620002,
      "updated_at": "2025-07-21T12:00:00-04:00",
      "requisition_id": "6/24/25 Mascot tysons",
      "title": "Costumed Characters (Mascot)",
      "company_name": "CAMP",
      "first_published": "2025-06-24T19:33:43-04:00",
      "language": "en"
    },
    {
      "absolute_url": "https://job-boards.greenhouse.io/camp/jobs/8174255002",
      "data_compliance": [
        {
          "type": "gdpr",
          "requires_consent": false,
          "requires_processing_consent": false,
          "requires_retention_consent": false,
          "retention_period": null,
          "demographic_data_consent_applies": false
        }
      ],
      "internal_job_id": 6239604002,
      "location": {
        "name": "Miami, FL (Aventura)"
      },
      "metadata": null,
      "id": 8174255002,
      "updated_at": "2025-10-24T18:03:18-04:00",
      "requisition_id": "9/17/2025 Miami Performer",
      "title": "Guest Experience Host",
      "company_name": "CAMP",
      "first_published": "2025-09-17T20:16:50-04:00",
      "language": "en"
    },
    {
      "absolute_url": "https://job-boards.greenhouse.io/camp/jobs/8200306002",
      "data_compliance": [
        {
          "type": "gdpr",
          "requires_consent": false,
          "requires_processing_consent": false,
          "requires_retention_consent": false,
          "retention_period": null,
          "demographic_data_consent_applies": false
        }
      ],
      "internal_job_id": 6250154002,
      "location": {
        "name": "Edina, MN (Southdale)"
      },
      "metadata": null,
      "id": 8200306002,
      "updated_at": "2025-10-24T17:20:28-04:00",
      "requisition_id": "10/6/25 GEH Edina",
      "title": "Guest Experience Host",
      "company_name": "CAMP",
      "first_published": "2025-10-06T18:56:30-04:00",
      "language": "en"
    },
    {
      "absolute_url": "https://job-boards.greenhouse.io/camp/jobs/8233926002",
      "data_compliance": [
        {
          "type": "gdpr",
          "requires_consent": false,
          "requires_processing_consent": false,
          "requires_retention_consent": false,
          "retention_period": null,
          "demographic_data_consent_applies": false
        }
      ],
      "internal_job_id": 6263400002,
      "location": {
        "name": "King of Prussia, PA"
      },
      "metadata": null,
      "id": 8233926002,
      "updated_at": "2025-10-29T17:38:05-04:00",
      "requisition_id": "10/29/25 KH KOP",
      "title": "Key Holder (Part-time)",
      "company_name": "CAMP",
      "first_published": "2025-10-29T17:38:05-04:00",
      "language": "en"
    },
    {
      "absolute_url": "https://job-boards.greenhouse.io/camp/jobs/8173969002",
      "data_compliance": [
        {
          "type": "gdpr",
          "requires_consent": false,
          "requires_processing_consent": false,
          "requires_retention_consent": false,
          "retention_period": null,
          "demographic_data_consent_applies": false
        }
      ],
      "internal_job_id": 6239465002,
      "location": {
        "name": "Edina, MN (Southdale)"
      },
      "metadata": null,
      "id": 8173969002,
      "updated_at": "2025-10-24T17:22:20-04:00",
      "requisition_id": "9/17/25 MN KH",
      "title": "Key Holder (PT)",
      "company_name": "CAMP",
      "first_published": "2025-09-17T16:00:05-04:00",
      "language": "en"
    },
    {
      "absolute_url": "https://job-boards.greenhouse.io/camp/jobs/8173957002",
      "data_compliance": [
        {
          "type": "gdpr",
          "requires_consent": false,
          "requires_processing_consent": false,
          "requires_retention_consent": false,
          "retention_period": null,
          "demographic_data_consent_applies": false
        }
      ],
      "internal_job_id": 6239459002,
      "location": {
        "name": "Miami, FL (Aventura)"
      },
      "metadata": null,
      "id": 8173957002,
      "updated_at": "2025-10-24T18:04:27-04:00",
      "requisition_id": "9/17/2025 FL KH",
      "title": "Key Holder (PT)",
      "company_name": "CAMP",
      "first_published": "2025-09-17T15:56:33-04:00",
      "language": "en"
    },
    {
      "absolute_url": "https://job-boards.greenhouse.io/camp/jobs/8208679002",
      "data_compliance": [
        {
          "type": "gdpr",
          "requires_consent": false,
          "requires_processing_consent": false,
          "requires_retention_consent": false,
          "retention_period": null,
          "demographic_data_consent_applies": false
        }
      ],
      "education": "education_optional",
      "internal_job_id": 6253308002,
      "location": {
        "name": "Chicago, IL; New York, NY (Corporate)"
      },
      "metadata": null,
      "id": 8208679002,
      "updated_at": "2025-10-21T12:16:14-04:00",
      "requisition_id": "10/11/25 OAB Labs",
      "title": "Omni Associate Buyer",
      "company_name": "CAMP",
      "first_published": "2025-10-11T15:38:07-04:00",
      "language": "en"
    },
    {
      "absolute_url": "https://job-boards.greenhouse.io/camp/jobs/8136667002",
      "data_compliance": [
        {
          "type": "gdpr",
          "requires_consent": false,
          "requires_processing_consent": false,
          "requires_retention_consent": false,
          "retention_period": null,
          "demographic_data_consent_applies": false
        }
      ],
      "internal_job_id": 6223626002,
      "location": {
        "name": "Burlington, MA"
      },
      "metadata": null,
      "id": 8136667002,
      "updated_at": "2025-08-25T17:01:10-04:00",
      "requisition_id": "8/25/25 MA SA",
      "title": "Sales Associate ",
      "company_name": "CAMP",
      "first_published": "2025-08-25T17:01:10-04:00",
      "language": "en"
    },
    {
      "absolute_url": "https://job-boards.greenhouse.io/camp/jobs/8139967002",
      "data_compliance": [
        {
          "type": "gdpr",
          "requires_consent": false,
          "requires_processing_consent": false,
          "requires_retention_consent": false,
          "retention_period": null,
          "demographic_data_consent_applies": false
        }
      ],
      "internal_job_id": 6225211002,
      "location": {
        "name": "King of Prussia, PA"
      },
      "metadata": null,
      "id": 8139967002,
      "updated_at": "2025-09-08T12:12:03-04:00",
      "requisition_id": "8/26/25 KOP SA",
      "title": "Sales Associate ",
      "company_name": "CAMP",
      "first_published": "2025-08-26T18:06:24-04:00",
      "language": "en"
    },
    {
      "absolute_url": "https://job-boards.greenhouse.io/camp/jobs/8126347002",
      "data_compliance": [
        {
          "type": "gdpr",
          "requires_consent": false,
          "requires_processing_consent": false,
          "requires_retention_consent": false,
          "retention_period": null,
          "demographic_data_consent_applies": false
        }
      ],
      "internal_job_id": 6219383002,
      "location": {
        "name": "New York, NY (5th Avenue)"
      },
      "metadata": null,
      "id": 8126347002,
      "updated_at": "2025-08-19T13:16:14-04:00",
      "requisition_id": "8/19/25 5th SA",
      "title": "Sales Associate ",
      "company_name": "CAMP",
      "first_published": "2025-08-19T13:16:14-04:00",
      "language": "en"
    },
    {
      "absolute_url": "https://job-boards.greenhouse.io/camp/jobs/8150424002",
      "data_compliance": [
        {
          "type": "gdpr",
          "requires_consent": false,
          "requires_processing_consent": false,
          "requires_retention_consent": false,
          "retention_period": null,
          "demographic_data_consent_applies": false
        }
      ],
      "internal_job_id": 6229711002,
      "location": {
        "name": "Atlanta, GA"
      },
      "metadata": null,
      "id": 8150424002,
      "updated_at": "2025-09-03T10:50:29-04:00",
      "requisition_id": "9/3/25 SA Atlanta",
      "title": "Sales Associate ",
      "company_name": "CAMP",
      "first_published": "2025-09-03T10:50:29-04:00",
      "language": "en"
    },
    {
      "absolute_url": "https://job-boards.greenhouse.io/camp/jobs/7835064002",
      "data_compliance": [
        {
          "type": "gdpr",
          "requires_consent": false,
          "requires_processing_consent": false,
          "requires_retention_consent": false,
          "retention_period": null,
          "demographic_data_consent_applies": false
        }
      ],
      "internal_job_id": 6089813002,
      "location": {
        "name": "Houston, TX"
      },
      "metadata": null,
      "id": 7835064002,
      "updated_at": "2025-07-21T12:00:00-04:00",
      "requisition_id": "HOU_SA_1/28/2025",
      "title": "Sales Associate ",
      "company_name": "CAMP",
      "first_published": "2025-01-28T15:04:52-05:00",
      "language": "en"
    },
    {
      "absolute_url": "https://job-boards.greenhouse.io/camp/jobs/8022146002",
      "data_compliance": [
        {
          "type": "gdpr",
          "requires_consent": false,
          "requires_processing_consent": false,
          "requires_retention_consent": false,
          "retention_period": null,
          "demographic_data_consent_applies": false
        }
      ],
      "internal_job_id": 6174464002,
      "location": {
        "name": "Los Angeles, CA (Century City)"
      },
      "metadata": null,
      "id": 8022146002,
      "updated_at": "2025-07-21T12:00:00-04:00",
      "requisition_id": "6/3/25 SA LA",
      "title": "Sales Associate ",
      "company_name": "CAMP",
      "first_published": "2025-07-07T19:42:55-04:00",
      "language": "en"
    },
    {
      "absolute_url": "https://job-boards.greenhouse.io/camp/jobs/8211404002",
      "data_compliance": [
        {
          "type": "gdpr",
          "requires_consent": false,
          "requires_processing_consent": false,
          "requires_retention_consent": false,
          "retention_period": null,
          "demographic_data_consent_applies": false
        }
      ],
      "internal_job_id": 6254394002,
      "location": {
        "name": "Chicago, IL"
      },
      "metadata": null,
      "id": 8211404002,
      "updated_at": "2025-10-14T15:30:44-04:00",
      "requisition_id": "10/14/25 AS Chicago",
      "title": "Sales Associate ",
      "company_name": "CAMP",
      "first_published": "2025-10-14T15:30:44-04:00",
      "language": "en"
    },
    {
      "absolute_url": "https://job-boards.greenhouse.io/camp/jobs/8211422002",
      "data_compliance": [
        {
          "type": "gdpr",
          "requires_consent": false,
          "requires_processing_consent": false,
          "requires_retention_consent": false,
          "retention_period": null,
          "demographic_data_consent_applies": false
        }
      ],
      "internal_job_id": 6254400002,
      "location": {
        "name": "Charlotte, NC (Southpark)"
      },
      "metadata": null,
      "id": 8211422002,
      "updated_at": "2025-10-14T15:37:19-04:00",
      "requisition_id": "10/14/25 SA NC",
      "title": "Sales Associate ",
      "company_name": "CAMP",
      "first_published": "2025-10-14T15:37:19-04:00",
      "language": "en"
    },
    {
      "absolute_url": "https://job-boards.greenhouse.io/camp/jobs/8022194002",
      "data_compliance": [
        {
          "type": "gdpr",
          "requires_consent": false,
          "requires_processing_consent": false,
          "requires_retention_consent": false,
          "retention_period": null,
          "demographic_data_consent_applies": false
        }
      ],
      "internal_job_id": 6174486002,
      "location": {
        "name": "Mc Lean, VA (Tysons Corner)"
      },
      "metadata": null,
      "id": 8022194002,
      "updated_at": "2025-07-21T12:00:00-04:00",
      "requisition_id": "6/3/25 SA Tysons",
      "title": "Sales Associate ",
      "company_name": "CAMP",
      "first_published": "2025-06-03T12:41:13-04:00",
      "language": "en"
    },
    {
      "absolute_url": "https://job-boards.greenhouse.io/camp/jobs/8245505002",
      "data_compliance": [
        {
          "type": "gdpr",
          "requires_consent": false,
          "requires_processing_consent": false,
          "requires_retention_consent": false,
          "retention_period": null,
          "demographic_data_consent_applies": false
        }
      ],
      "internal_job_id": 6269007002,
      "location": {
        "name": "Houston, TX"
      },
      "metadata": null,
      "id": 8245505002,
      "updated_at": "2025-11-06T00:40:05-05:00",
      "requisition_id": "11/1/25 SEA Houston",
      "title": "Seasonal Sales Associate ",
      "company_name": "CAMP",
      "first_published": "2025-11-06T00:40:05-05:00",
      "language": "en"
    },
    {
      "absolute_url": "https://job-boards.greenhouse.io/camp/jobs/8245480002",
      "data_compliance": [
        {
          "type": "gdpr",
          "requires_consent": false,
          "requires_processing_consent": false,
          "requires_retention_consent": false,
          "retention_period": null,
          "demographic_data_consent_applies": false
        }
      ],
      "internal_job_id": 6268987002,
      "location": {
        "name": "New York, NY (5th Avenue)"
      },
      "metadata": null,
      "id": 8245480002,
      "updated_at": "2025-11-06T00:14:03-05:00",
      "requisition_id": "11/1/25 SEA 5th",
      "title": "Seasonal Sales Associate ",
      "company_name": "CAMP",
      "first_published": "2025-11-06T00:14:03-05:00",
      "language": "en"
    },
    {
      "absolute_url": "https://job-boards.greenhouse.io/camp/jobs/8245490002",
      "data_compliance": [
        {
          "type": "gdpr",
          "requires_consent": false,
          "requires_processing_consent": false,
          "requires_retention_consent": false,
          "retention_period": null,
          "demographic_data_consent_applies": false
        }
      ],
      "internal_job_id": 6268994002,
      "location": {
        "name": "Atlanta, GA"
      },
      "metadata": null,
      "id": 8245490002,
      "updated_at": "2025-11-06T00:21:23-05:00",
      "requisition_id": "11/1/25 SEA Atlanta",
      "title": "Seasonal Sales Associate ",
      "company_name": "CAMP",
      "first_published": "2025-11-06T00:20:18-05:00",
      "language": "en"
    },
    {
      "absolute_url": "https://job-boards.greenhouse.io/camp/jobs/8245491002",
      "data_compliance": [
        {
          "type": "gdpr",
          "requires_consent": false,
          "requires_processing_consent": false,
          "requires_retention_consent": false,
          "retention_period": null,
          "demographic_data_consent_applies": false
        }
      ],
      "internal_job_id": 6268995002,
      "location": {
        "name": "Burlington, MA"
      },
      "metadata": null,
      "id": 8245491002,
      "updated_at": "2025-11-06T00:24:16-05:00",
      "requisition_id": "11/1/25 SEA Bur",
      "title": "Seasonal Sales Associate ",
      "company_name": "CAMP",
      "first_published": "2025-11-06T00:24:16-05:00",
      "language": "en"
    },
    {
      "absolute_url": "https://job-boards.greenhouse.io/camp/jobs/8245496002",
      "data_compliance": [
        {
          "type": "gdpr",
          "requires_consent": false,
          "requires_processing_consent": false,
          "requires_retention_consent": false,
          "retention_period": null,
          "demographic_data_consent_applies": false
        }
      ],
      "internal_job_id": 6268998002,
      "location": {
        "name": "Los Angeles, CA (Century City)"
      },
      "metadata": null,
      "id": 8245496002,
      "updated_at": "2025-11-06T00:27:09-05:00",
      "requisition_id": "11/1/25 SEA LA",
      "title": "Seasonal Sales Associate ",
      "company_name": "CAMP",
      "first_published": "2025-11-06T00:27:09-05:00",
      "language": "en"
    },
    {
      "absolute_url": "https://job-boards.greenhouse.io/camp/jobs/8245497002",
      "data_compliance": [
        {
          "type": "gdpr",
          "requires_consent": false,
          "requires_processing_consent": false,
          "requires_retention_consent": false,
          "retention_period": null,
          "demographic_data_consent_applies": false
        }
      ],
      "internal_job_id": 6268999002,
      "location": {
        "name": "Chicago, IL"
      },
      "metadata": null,
      "id": 8245497002,
      "updated_at": "2025-11-06T00:29:46-05:00",
      "requisition_id": "11/1/25 SEA Chicago",
      "title": "Seasonal Sales Associate ",
      "company_name": "CAMP",
      "first_published": "2025-11-06T00:29:46-05:00",
      "language": "en"
    },
    {
      "absolute_url": "https://job-boards.greenhouse.io/camp/jobs/8245502002",
      "data_compliance": [
        {
          "type": "gdpr",
          "requires_consent": false,
          "requires_processing_consent": false,
          "requires_retention_consent": false,
          "retention_period": null,
          "demographic_data_consent_applies": false
        }
      ],
      "internal_job_id": 6269004002,
      "location": {
        "name": "Charlotte, NC (Southpark)"
      },
      "metadata": null,
      "id": 8245502002,
      "updated_at": "2025-11-06T00:32:31-05:00",
      "requisition_id": "11/1/25 SEA NC",
      "title": "Seasonal Sales Associate ",
      "company_name": "CAMP",
      "first_published": "2025-11-06T00:32:31-05:00",
      "language": "en"
    },
    {
      "absolute_url": "https://job-boards.greenhouse.io/camp/jobs/8245503002",
      "data_compliance": [
        {
          "type": "gdpr",
          "requires_consent": false,
          "requires_processing_consent": false,
          "requires_retention_consent": false,
          "retention_period": null,
          "demographic_data_consent_applies": false
        }
      ],
      "internal_job_id": 6269005002,
      "location": {
        "name": "King of Prussia, PA"
      },
      "metadata": null,
      "id": 8245503002,
      "updated_at": "2025-11-06T00:35:06-05:00",
      "requisition_id": "11/1/25 SEA KOP",
      "title": "Seasonal Sales Associate ",
      "company_name": "CAMP",
      "first_published": "2025-11-06T00:35:06-05:00",
      "language": "en"
    },
    {
      "absolute_url": "https://job-boards.greenhouse.io/camp/jobs/8245504002",
      "data_compliance": [
        {
          "type": "gdpr",
          "requires_consent": false,
          "requires_processing_consent": false,
          "requires_retention_consent": false,
          "retention_period": null,
          "demographic_data_consent_applies": false
        }
      ],
      "internal_job_id": 6269006002,
      "location": {
        "name": "Mc Lean, VA (Tysons Corner)"
      },
      "metadata": null,
      "id": 8245504002,
      "updated_at": "2025-11-06T00:37:36-05:00",
      "requisition_id": "11/1/25 SEA Tysons",
      "title": "Seasonal Sales Associate ",
      "company_name": "CAMP",
      "first_published": "2025-11-06T00:37:36-05:00",
      "language": "en"
    },
    {
      "absolute_url": "https://job-boards.greenhouse.io/camp/jobs/8218267002",
      "data_compliance": [
        {
          "type": "gdpr",
          "requires_consent": false,
          "requires_processing_consent": false,
          "requires_retention_consent": false,
          "retention_period": null,
          "demographic_data_consent_applies": false
        }
      ],
      "education": "education_optional",
      "internal_job_id": 6256761002,
      "location": {
        "name": "New York, NY (Corporate)"
      },
      "metadata": null,
      "id": 8218267002,
      "updated_at": "2025-10-17T19:47:11-04:00",
      "requisition_id": "10/17/25 Labs",
      "title": "Ticketing & Revenue Manager",
      "company_name": "CAMP",
      "first_published": "2025-10-17T19:41:53-04:00",
      "language": "en"
    }
  ]
}